{
  "$schema": "http://json-schema.org/draft-07/schema#",
  "$id": "https://raw.githubusercontent.com/HireAll-ai/autopilot-skills/main/autopilot/schema/autopilot.config.schema.json",
  "title": "autopilot.config",
  "description": "Per-project configuration for the portable /autodev, /autoship and /autopilot commands. Committed to the repo so the same command logic works in any project. Generated (and re-generatable with --reconfigure) by the first-run interview in lib/autopilot-config.sh.",
  "type": "object",
  "additionalProperties": false,
  "required": ["version", "tracker", "git", "commands", "review", "deploy", "qa", "rules"],
  "properties": {
    "version": {
      "type": "integer",
      "const": 1,
      "description": "Config schema version. Bump when the shape changes incompatibly."
    },
    "$schema": {
      "type": "string",
      "description": "Optional pointer to this schema for editor validation."
    },
    "$comment": {
      "type": "string",
      "description": "Optional free-text note (e.g. which plugin consumes this config and how to install it)."
    },

    "tracker": {
      "type": "object",
      "additionalProperties": false,
      "required": ["type", "keyRequired"],
      "description": "Issue tracker used for ticket keys and status transitions.",
      "properties": {
        "type": {
          "enum": ["jira", "linear", "github", "backlog", "none"],
          "description": "Tracker kind. 'backlog' (the default when it runs) is the local ai-backlog tracker; its MCP server (conventionally 'mcp__backlog') is served by the tracker at http://127.0.0.1:4400/mcp, and its issues start Conductor workspaces with /autopilot:autopilot or /autopilot:autodev by size. A repo can hold several backlog projects: keys of every project bound to it (list_projects with repoPath) are valid and keyPrefix is the default project for new issues. 'none' disables ticket handling."
        },
        "mcp": {
          "type": "string",
          "description": "MCP server namespace prefix that exposes the tracker (e.g. 'mcp__jira-server'). Empty/omitted when type is 'none' or the tracker is driven purely via CLI."
        },
        "keyPrefix": {
          "type": "string",
          "description": "Ticket / branch / commit key prefix (e.g. 'PROJ'). Empty string when the project uses no prefixed keys."
        },
        "keyRequired": {
          "type": "boolean",
          "description": "When true, a change with no tracker key is a hard stop: /autodev asks for the key (or creates the issue when autoCreateIssue is true); when false, the key is optional."
        },
        "autoCreateIssue": {
          "type": "boolean",
          "default": false,
          "description": "When true and keyRequired, /autodev may open the tracker issue itself (via mcp) for work that clearly has none. Default false: it asks for the key instead — many repos reserve opening tickets for a human."
        },
        "shipStatus": {
          "type": "string",
          "description": "Status the ticket is moved to on a fully successful ship (e.g. 'In Review'). Omitted when tracker.type is 'none'."
        },
        "shipStatusVia": {
          "type": "array",
          "items": { "type": "string" },
          "description": "Ordered intermediate statuses the board may require before shipStatus (e.g. ['In Progress']). Empty when a direct transition exists."
        },
        "followUps": {
          "enum": ["ask", "off"],
          "default": "ask",
          "description": "Follow-up tasks proposed at the end of /autodev, /autoship and /autopilot (lib/follow-ups.md). 'ask' (default): draft them, let the operator pick, file the picked ones via the tracker MCP (or print them when the tracker can't take them). 'off': don't propose follow-ups."
        }
      }
    },

    "git": {
      "type": "object",
      "additionalProperties": false,
      "required": ["baseBranch", "mergeStrategy", "protection"],
      "description": "Branching, merge strategy and branch-protection facts that gate the merge.",
      "properties": {
        "baseBranch": {
          "type": "string",
          "description": "Branch PRs target and that auto-deploys (e.g. 'develop' or 'main')."
        },
        "branchPattern": {
          "type": "string",
          "description": "Template for feature branch names. Placeholders: {key} (tracker key as written, e.g. 'POS-42'), {key_lower} (the key lower-cased, e.g. 'pos-42' — Linear's default branch style), {slug} (short kebab-case summary). The key is found in a branch name case-insensitively either way.",
          "default": "{key}-{slug}"
        },
        "commitStyle": {
          "enum": ["key-prefix", "conventional"],
          "default": "key-prefix",
          "description": "Shape of commit subjects and the PR title (the squash subject). 'key-prefix' = '<KEY>: what + why'. 'conventional' = Conventional Commits 1.0 'type(scope): summary' (imperative, <=72 chars, no key in the subject); the tracker key goes in a 'Ticket: <KEY>' line in the PR body and a 'Refs: <KEY>' commit trailer."
        },
        "mergeStrategy": {
          "enum": ["squash", "merge", "rebase"],
          "description": "Merge method. 'squash' keeps linear history."
        },
        "deleteBranchOnMerge": {
          "type": "boolean",
          "default": true,
          "description": "Pass --delete-branch on merge."
        },
        "mergeQueue": {
          "type": "boolean",
          "default": false,
          "description": "True when the base branch merges through a GitHub merge queue: /autoship enqueues with 'gh pr merge --auto' and waits for the queue instead of merging directly. Also taken at run time when a direct merge is rejected for requiring a merge queue."
        },
        "protection": {
          "type": "object",
          "additionalProperties": false,
          "required": ["requiredChecks", "strict"],
          "description": "Autodetected from the base branch's protection (gh api repos/{o}/{r}/branches/{base}/protection).",
          "properties": {
            "requiredChecks": {
              "type": "array",
              "items": { "type": "string" },
              "description": "Status checks that must be green to merge (e.g. ['build']). Empty when none are required."
            },
            "strict": {
              "type": "boolean",
              "description": "required_status_checks.strict — when false a behind branch still merges (no forced sync)."
            },
            "requireThreadResolution": {
              "type": "boolean",
              "default": false,
              "description": "required_conversation_resolution — all review threads must be resolved to merge."
            },
            "requiredApprovals": {
              "type": "integer",
              "minimum": 0,
              "default": 0,
              "description": "required_approving_review_count."
            },
            "adminBypassAllowed": {
              "type": "boolean",
              "default": false,
              "description": "enforce_admins is OFF → --admin may bypass protection ONLY once every visible check is independently confirmed green."
            }
          }
        }
      }
    },

    "commands": {
      "type": "object",
      "additionalProperties": false,
      "required": ["typecheck"],
      "description": "Shell commands the pipeline runs. Empty string or omitted = 'this project has no such command; skip the step'. {pkg} in testFilter is replaced with a package name.",
      "properties": {
        "install": { "type": "string", "description": "Dependency install (e.g. 'pnpm install --frozen-lockfile')." },
        "typecheck": { "type": "string", "description": "Type/compile gate that MUST pass before any commit (e.g. 'pnpm type-check'). Set '' if the project has no type-check." },
        "test": { "type": "string", "description": "Full test command (e.g. 'pnpm test')." },
        "testFilter": { "type": "string", "description": "Targeted test template with {pkg} placeholder (e.g. 'pnpm --filter {pkg} test')." },
        "build": { "type": "string", "description": "Production build (e.g. 'pnpm build')." },
        "dev": { "type": "string", "description": "Local dev server used to warm the app for UI QA (e.g. 'pnpm dev')." },
        "lint": { "type": ["string", "null"], "description": "Optional lint command, or null." }
      }
    },

    "review": {
      "type": "object",
      "additionalProperties": false,
      "required": ["gate"],
      "description": "Automated PR-review gate and local reviewers.",
      "properties": {
        "gate": {
          "enum": ["greptile", "coderabbit", "github", "none"],
          "description": "Automated PR reviewer. 'none' skips the review loop."
        },
        "skill": {
          "type": "string",
          "description": "Skill/command that drives the review loop (e.g. 'greploop'). Omitted when gate is 'none'."
        },
        "passBar": {
          "type": "string",
          "description": "Threshold the loop holds to (e.g. '5/5'). Free-form; interpreted by the review skill."
        },
        "mention": {
          "type": "string",
          "description": "Bot mention that re-triggers review when needed (e.g. '@greptileai')."
        },
        "localReviewers": {
          "type": "array",
          "items": { "type": "string" },
          "description": "Local pre-push reviewers run on the diff (e.g. ['/review', '/codex'])."
        }
      }
    },

    "deploy": {
      "type": "object",
      "additionalProperties": false,
      "required": ["trigger"],
      "description": "How merging reaches an environment, and how to smoke-test it.",
      "properties": {
        "trigger": {
          "enum": ["merge-to-base", "github-action", "manual", "none"],
          "description": "'merge-to-base' = merging the base branch auto-deploys; 'none' = no deploy step."
        },
        "autoDeploys": {
          "type": "boolean",
          "description": "True when the deploy runs automatically off the merge (no manual step)."
        },
        "healthcheck": {
          "type": "string",
          "description": "URL curled to confirm the environment is up (e.g. 'http://host:8080/api/health')."
        },
        "urls": {
          "type": "object",
          "additionalProperties": { "type": "string" },
          "description": "Named environment URLs used by the canary (e.g. {\"client\":\"...\",\"admin\":\"...\"})."
        },
        "verify": {
          "type": "object",
          "additionalProperties": false,
          "description": "How to confirm the merge is actually LIVE before claiming a deploy. Omit only when nothing can confirm it. NOTE: when an external builder deploys (Coolify, Vercel, Render, Fly), a green push-triggered CI run on the base branch is NOT evidence of a deploy — that builder is invisible to `gh run`, and the healthcheck keeps answering from the previous build until the swap. Configure a build-id endpoint instead.",
          "properties": {
            "mode": {
              "enum": ["build-id", "github-run", "none"],
              "description": "'build-id' = poll buildIdUrl until it reports the merge SHA (the only honest check with an external builder); 'github-run' = the deploy IS a GitHub Actions run, so watch the push run for the merge SHA; 'none' = nothing can confirm it — canary anyway and report the deploy as UNVERIFIED. Absent: inferred as 'github-run' when deploy.trigger is 'github-action', else 'none'."
            },
            "buildIdUrl": {
              "type": "string",
              "description": "mode=build-id: URL returning the commit the running build was made from (e.g. 'https://app.example.com/version')."
            },
            "buildIdJq": {
              "type": "string",
              "description": "mode=build-id: jq filter selecting the commit from that response (e.g. '.commit'). Default '.commit'."
            },
            "restartedAtJq": {
              "type": "string",
              "description": "mode=build-id, optional: jq filter for a process-start timestamp (e.g. '.startedAt'). Used as the fallback signal when the commit reads as unknown/empty because the build arg never arrived — a restart after the merge time then counts as deployed, and the report says so."
            },
            "timeoutSeconds": {
              "type": "integer",
              "description": "How long to poll before reporting the deploy unverified (not failed). Default 600."
            },
            "workflow": {
              "type": "string",
              "description": "mode=github-run: the deploy workflow's name or file (e.g. 'deploy.yml'). A merge usually starts several push runs (CI, lint, deploy); without this, every push run for the merge SHA must go green before the deploy counts as verified."
            }
          }
        },
        "canarySkill": {
          "type": "string",
          "description": "Skill/command for the post-deploy canary (e.g. '/canary')."
        },
        "docsRef": {
          "type": "string",
          "description": "Human-readable pointer to the source of truth for these values (e.g. 'CLAUDE.md §Staging Server') so they can be re-derived without trusting this file."
        },
        "envSecret": {
          "type": "string",
          "description": "Name of the env var / CI secret holding deploy credentials (e.g. 'DEPLOY_SSH_KEY'). Never the value itself."
        }
      }
    },

    "qa": {
      "type": "object",
      "additionalProperties": false,
      "description": "Browser QA / e2e skills and video recording of the e2e run.",
      "properties": {
        "browseSkill": { "type": "string", "description": "Browser-driving skill (e.g. '/browse')." },
        "qaSkill": { "type": "string", "description": "Heuristic bug-hunting QA skill (e.g. '/qa')." },
        "qaOnlySkill": { "type": "string", "description": "Report-only QA skill for post-merge staging (e.g. '/qa-only')." },
        "preview": {
          "type": "object",
          "additionalProperties": false,
          "description": "Local preview handed to the human at the /autodev verification gate (Step 4.8): a link they can click, landed past the login wall.",
          "properties": {
            "url": {
              "type": "string",
              "description": "Base URL of the local dev server when it cannot be read from the server's own output (e.g. a sandbox-assigned port). May name an env var (e.g. 'http://localhost:$CONDUCTOR_PORT'), resolved at run time. Omit to always take the URL the dev server prints."
            },
            "authPath": {
              "type": "string",
              "description": "Dev-only route that mints a real local session (e.g. '/dev-login'), so the preview link doesn't land on a login wall the agent has no password for. Omit when the app needs no auth."
            }
          }
        },
        "video": {
          "type": "object",
          "additionalProperties": false,
          "description": "Opt-in video recording of the --e2e scenario run.",
          "properties": {
            "enabled": {
              "type": "boolean",
              "default": false,
              "description": "Record video during --e2e runs."
            },
            "format": {
              "enum": ["mp4", "gif", "webm"],
              "default": "mp4",
              "description": "Preferred output. mp4/gif need ffmpeg; without ffmpeg the recorder keeps webm regardless."
            },
            "surface": {
              "enum": ["context", "pr-gif", "both", "none"],
              "default": "context",
              "description": "Where the artifact goes: 'context' = write to .context/ for the Conductor chat; 'pr-gif' = also embed a gif in the PR body; 'both'; 'none' = record but don't surface."
            },
            "dir": {
              "type": "string",
              "default": ".context/video",
              "description": "Directory (repo-relative) the recorder writes into."
            },
            "maxSeconds": {
              "type": "integer",
              "minimum": 5,
              "default": 90,
              "description": "Hard cap on a single scenario recording to keep artifacts small."
            }
          }
        }
      }
    },

    "rules": {
      "type": "object",
      "additionalProperties": false,
      "description": "Where the repo's own engineering rules and planning artifacts live. The commands defer to these instead of embedding project rules.",
      "properties": {
        "docs": {
          "type": "array",
          "items": { "type": "string" },
          "description": "Rule docs the agent must obey (e.g. ['CLAUDE.md','docs/development.md']). CLAUDE.md/AGENTS.md are the primary source."
        },
        "planDir": {
          "type": "string",
          "description": "Where task-by-task plans are written (e.g. 'docs/superpowers/plans')."
        },
        "specDir": {
          "type": "string",
          "description": "Where specs for large features are written (e.g. 'docs/superpowers/specs')."
        },
        "prTemplate": {
          "type": "string",
          "description": "Path to the PR template that must be populated (e.g. '.github/pull_request_template.md')."
        }
      }
    }
  }
}
